{
  "schema_version": "0.1.0",
  "work_item_id": "work-item-notice-action-001",
  "source_module": "redshieldworks-docs",
  "work_item_type": "notice-action",
  "priority": "normal",
  "summary": "Review synthetic GST/QST filing-frequency notice action.",
  "status": "proposed",
  "approval": {
    "required": true,
    "status": "proposed",
    "gate": "tax_action"
  },
  "created_at": "2026-06-12T12:05:00Z",
  "due_at": "2026-06-19T12:05:00Z",
  "evidence_refs": [
    {
      "schema_version": "0.1.0",
      "evidence_id": "evidence-generated-workpaper-001",
      "evidence_type": "workpaper",
      "source": {
        "location_type": "generated_output",
        "locator": "output/handoff_package/gifi_summary.csv",
        "display_name": "Synthetic GIFI summary workpaper"
      },
      "sensitivity": "confidential",
      "created_at": "2026-06-12T12:00:00Z"
    }
  ],
  "context": {
    "jurisdiction": "qc",
    "notice_type": "gst-qst-frequency",
    "synthetic": true
  },
  "implementation": {
    "state": "waiting_for_approval"
  }
}
